{
  "ticker": "MPWR",
  "name": "Monolithic Power Systems, Inc.",
  "country": "US",
  "exchange": "XNAS",
  "sector": "Technology",
  "industry": "Semiconductors",
  "currency": "USD",
  "marketCap": {
    "value": 76947898368.0,
    "currency": "USD",
    "asOf": "2026-05-30"
  },
  "price": {
    "value": 1566.21,
    "currency": "USD",
    "asOf": "2026-05-30"
  },
  "fundamentals": {
    "revenue": 2790459000.0,
    "operatingIncome": 728636000.0,
    "netIncome": 621483000.0,
    "eps": 12.86,
    "freeCashFlow": 663261000.0,
    "totalDebt": 19972000.0,
    "cash": 1099302000.0,
    "sharesOutstanding": 48709000.0
  },
  "ratios": {
    "roe": 0.17598287638358465,
    "roic": 0.20516467974238267,
    "grossMargin": 0.551787716644466,
    "operatingMargin": 0.26111689868942706,
    "netMargin": 0.2227171228819345,
    "debtToEquity": 0.005430000000000001
  },
  "historicalFinancials": [
    {
      "fiscalYear": 2021,
      "periodEnd": "2021-12-31",
      "revenue": null,
      "operatingIncome": null,
      "netIncome": null,
      "eps": null,
      "freeCashFlow": null,
      "totalDebt": null,
      "cash": null,
      "sharesOutstanding": null,
      "grossMargin": null,
      "operatingMargin": null,
      "netMargin": null,
      "roe": null,
      "roic": null
    },
    {
      "fiscalYear": 2022,
      "periodEnd": "2022-12-31",
      "revenue": 1794148000.0,
      "operatingIncome": 526785000.0,
      "netIncome": 437672000.0,
      "eps": 9.05,
      "freeCashFlow": 187831000.0,
      "totalDebt": 1664000.0,
      "cash": 288607000.0,
      "sharesOutstanding": 47107000.0,
      "grossMargin": 0.5844289322842932,
      "operatingMargin": 0.29361290149976477,
      "netMargin": 0.24394420081286494,
      "roe": 0.26229861884379857,
      "roic": 0.3153898840064996
    },
    {
      "fiscalYear": 2023,
      "periodEnd": "2023-12-31",
      "revenue": 1821072000.0,
      "operatingIncome": 481736000.0,
      "netIncome": 427374000.0,
      "eps": 8.76,
      "freeCashFlow": 580635000.0,
      "totalDebt": 5565000.0,
      "cash": 527843000.0,
      "sharesOutstanding": 48028000.0,
      "grossMargin": 0.5607241229341838,
      "operatingMargin": 0.26453429628262914,
      "netMargin": 0.2346826484620048,
      "roe": 0.20848132554188198,
      "roic": 0.23436393215483892
    },
    {
      "fiscalYear": 2024,
      "periodEnd": "2024-12-31",
      "revenue": 2207100000.0,
      "operatingIncome": 539358000.0,
      "netIncome": 1592058000.0,
      "eps": 36.59,
      "freeCashFlow": 624117000.0,
      "totalDebt": 12974000.0,
      "cash": 691816000.0,
      "sharesOutstanding": 47823000.0,
      "grossMargin": 0.5531557247066287,
      "operatingMargin": 0.24437406551583526,
      "netMargin": 0.7213347831996738,
      "roe": 0.5394749459951713,
      "roic": 0.1819635578973577
    },
    {
      "fiscalYear": 2025,
      "periodEnd": "2025-12-31",
      "revenue": 2790459000.0,
      "operatingIncome": 728636000.0,
      "netIncome": 621483000.0,
      "eps": 12.86,
      "freeCashFlow": 663261000.0,
      "totalDebt": 19972000.0,
      "cash": 1099302000.0,
      "sharesOutstanding": 48709000.0,
      "grossMargin": 0.551787716644466,
      "operatingMargin": 0.26111689868942706,
      "netMargin": 0.2227171228819345,
      "roe": 0.17598287638358465,
      "roic": 0.20516467974238267
    }
  ],
  "meta": {
    "source": "yfinance",
    "lastUpdated": "2026-05-30T18:35:56.394045+00:00"
  }
}